,title,disciption,Imdb_rating,genres,Released_date,image_url,thombnil_url,webpage_url
0,Black Adam,The story of the DC superhero comes to the big screen in this thrilling action-adventure starring Dwayne Johnson.,IMDb 6.3,Science Fiction·Fantasy·Adventure·Action,2022,https://images-eu.ssl-images-amazon.com/images/S/pv-target-images/a5379fd0248d22e360432ca3c0f1988d751986463bcf40f1b28dbbcd6e1ef917._RI_V_TTW_SX720_FMjpg_.jpg,"https://m.media-amazon.com/images/S/pv-target-images/2755192ac73b7b4a52f50e3297813231e2dd086b9b090a17d6b72722717e05d9._UR1920,1080_SX720_FMjpg_.jpg",https://www.primevideo.com/detail/0KIF0RIKEBJJANNU4HDOJ42WN5/ref=atv_br_def_r_br_c_unkc_1_1
1,Fall,"For best friends Becky and Hunter, life is all about conquering fears and pushing limits. However, after they climb 2,000 feet to the top of a remote, abandoned radio tower, they find themselves stranded with no way down. Now, their expert climbing skills are put to the ultimate test as they desperately fight to survive the elements, a lack of supplies, and vertigo-inducing heights.",IMDb 6.4,Suspense·Adventure·Drama,2022,https://images-eu.ssl-images-amazon.com/images/S/pv-target-images/751b59ec1eb18790277a774d2e820f129fc3d87713f5f40b7e075731adc1da49._RI_V_TTW_SX720_FMjpg_.png,"https://m.media-amazon.com/images/S/pv-target-images/435ccea8c4332ffb15f98169eecf5050225dbf23b15de8edbc1389c22ed47f65._UR1920,1080_SX720_FMjpg_.jpg",https://www.primevideo.com/detail/0J80QLS1VW84KTO0XWOR4WVHVS/ref=atv_br_def_r_br_c_unkc_1_2
2,Smile,"After witnessing a bizarre, traumatic incident involving a patient, Dr. Rose Cotter (Sosie Bacon) starts experiencing frightening occurrences that she can't explain. As an overwhelming terror begins taking over her life, Rose must confront her troubling past in order to survive and escape her horrifying new reality.",IMDb 6.5,Suspense·Horror,2022,https://images-eu.ssl-images-amazon.com/images/S/pv-target-images/8504d29eecac44a05319189ffd87cc6c3bc9e36bb10b0c3cecc5387fe9566b20._RI_V_TTW_SX720_FMjpg_.png,"https://m.media-amazon.com/images/S/pv-target-images/65ef965f8d67a788d0867f3d9864ba3800115d75078eb76b6cefcc08382b0a4d._UR1920,1080_SX720_FMjpg_.jpg",https://www.primevideo.com/detail/0KF15RP03LOCHLXIVU0MITD6KU/ref=atv_br_def_r_br_c_unkc_1_3
3,F9: The Fast Saga,"The true meaning of family gets tested like never before as Dom Toretto takes the team on a worldwide ride with high-stakes action, old friends and a surprising new foe.",IMDb 5.2,Suspense·Action·Electrifying·Gritty,2021,https://images-eu.ssl-images-amazon.com/images/S/pv-target-images/ac77217c18b4d7d3350ebd71e93cb425ee3fe7202948779eb61f648ccf8c5d6f._RI_V_TTW_SX720_FMjpg_.png,"https://m.media-amazon.com/images/S/pv-target-images/8f75cb6fe3d04ba2bf2542123dd56e245d42ca27a6f6f8fd5eabf05e901b105a._UR1920,1080_SX720_FMjpg_.jpg",https://www.primevideo.com/detail/0FGURA7QG2V4L499UCH2X2LG79/ref=atv_br_def_r_br_c_unkc_1_4
4,Harry Potter and the Sorcerer's Stone,"Based on the wildly popular J.K. Rowling's book about a young boy who on his eleventh birthday discovers, he is the orphaned boy of two powerful wizards and has unique magical powers.",IMDb 7.6,Fantasy·Adventure·Fantastic·Mysterious,2001,https://images-eu.ssl-images-amazon.com/images/S/pv-target-images/e3bf33a22908286509fbcb897eec8daee7b2f679e83530ad861eb86c5bfa9e9c._RI_V_TTW_SX720_FMjpg_.jpg,"https://m.media-amazon.com/images/S/pv-target-images/447b1a625367ccb31c30b212a00f082bad47b59c337cdeee474a2306213ff66f._UR1920,1080_SX720_FMjpg_.jpg",https://www.primevideo.com/detail/0N8WYH0W6L7Q0ODHGQCHMMRH4R/ref=atv_br_def_r_br_c_unkc_1_5
5,Top Gun: Maverick,"After thirty years, Maverick (Tom Cruise) is still pushing the envelope as a top naval aviator, but must confront ghosts of his past when he leads TOP GUN's elite graduates on a mission that demands the ultimate sacrifice from those chosen to fly it.",IMDb 8.3,Drama·Action,2022,https://images-eu.ssl-images-amazon.com/images/S/pv-target-images/2d2032ce9f6519a846ae53da9c7d225501a2fc6e190bf75a4aebbfc6ca202509._RI_V_TTW_SX720_FMjpg_.png,"https://m.media-amazon.com/images/S/pv-target-images/7088d227b32666e57dd43373a1277e46b88fadb27c309b96dd90302c32ccfbf8._UR1920,1080_SX720_FMjpg_.jpg",https://www.primevideo.com/detail/0SSXASJCFFG34TN8CBQFM0TN90/ref=atv_br_def_r_br_c_unkc_1_6
6,None,"In this extraordinary true story of faith and survival, ON A WING AND A PRAYER follows passenger Doug White’s (Dennis Quaid) harrowing journey to safely land a plane and save his entire family from insurmountable danger, after their pilot dies unexpectedly mid-flight.",IMDb 5.6,Drama,2023,https://images-eu.ssl-images-amazon.com/images/S/pv-target-images/0589010afbdc6510b1f925bdb89ec5330f9dd95667f05a25e49390b5ef1d78d2._RI_V_TTW_SX720_FMjpg_.jpg,"https://m.media-amazon.com/images/S/pv-target-images/6aee471e6a38191419f26fb56935eb3b21bda2645810d8be548c0673cb6664fb._UR1920,1080_SX720_FMjpg_.png",https://www.primevideo.com/detail/0T9T66NERYD9X0JZAOABMXIQDO/ref=atv_br_def_r_br_c_unkc_1_7
7,The Lair,"Shot down over one of the most dangerous rebel strongholds in Afghanistan, a Royal Air Force pilot discovers an abandoned Soviet Research Facility concealed in the remote hills. She finds refuge in an underground bunker where deadly man-made biological weapons - half human, half alien and hungry for human flesh are awakened as she watches the creatures rip apart the men pursuing her.",IMDb 4.5,Horror·Action,2022,https://images-eu.ssl-images-amazon.com/images/S/pv-target-images/0f211c01bfba57031185d3c839f1d201a408da5fc6bdd77a2f54a692879acfc1._RI_V_TTW_SX720_FMjpg_.png,"https://m.media-amazon.com/images/S/pv-target-images/c16c15f4d8db0d177d7913b8ef042ab001f2832e0fdda8f8843eece6b6cc3c8f._UR1920,1080_SX720_FMjpg_.jpg",https://www.primevideo.com/detail/0OUGRSCVMMK2NWFO4NMCY947UP/ref=atv_br_def_r_br_c_unkc_1_8
8,Sayen,"In the forests of southern Chile, a young Mapuche woman, Sayen, sets out to hunt down the mercenaries who murdered her grandmother.  Utilizing her training, she is able to survive and turn the tables on these interlopers.  She must choose between walking away, or protecting not only her own but also other indigenous groups from the sinister corporation that threatens their lands and livelihoods.",IMDb 4.5,Suspense·International·Drama·Action,2023,https://images-eu.ssl-images-amazon.com/images/S/pv-target-images/76e4c2e29cd6693686cf2d0c60be20254b4484bd90d2318d787b99632fe60d12._RI_V_TTW_SX720_FMjpg_.jpg,"https://m.media-amazon.com/images/S/pv-target-images/2561eecd24d95fa84f197891972c016e1d0c033819719d494b6516d9cb649c86._UR1920,1080_SX720_FMjpg_.jpg",https://www.primevideo.com/detail/0TAUXWHEAUYZ4MVIGUT44WCFVF/ref=atv_br_def_r_br_c_unkc_1_9
9,Harry Potter and the Prisoner of Azkaban,"In Harry Potter and the Prisoner of Azkaban, Harry, Ron and Hermione return for their third year at Hogwarts, where they are forced to face escaped prisoner, Sirius Black.",IMDb 7.9,Fantasy·Adventure·Ambitious·Dreamlike,2004,https://images-eu.ssl-images-amazon.com/images/S/pv-target-images/57c1cbe46786505624f2f36c4e1aad59ce743aab58b55c8d14c0c9fae45177a6._RI_V_TTW_SX720_FMjpg_.jpg,"https://m.media-amazon.com/images/S/pv-target-images/7951ceed4a1cb73c5aa4276c038a1cabf13f98283834309975a024a158c2de0b._UR1920,1080_SX720_FMjpg_.jpg",https://www.primevideo.com/detail/0HKBCOWZ6L75JX0GXBANJSQLIM/ref=atv_br_def_r_br_c_unkc_1_10
